### ISSUE TITLE
Twitter Picture/Video Loading Problem

### ISSUE THREAD

**Issue by budakcivic** [n00neimp0rtant/xCon-Issues#456]
Just found new bugs after updating twitter on iphone. All any picture/video loading error. Have to uninstalled xcon v40 for ios8 then ok.
![image](https://cloud.githubusercontent.com/assets/10070283/5996577/61172080-aae7-11e4-8641-b1a03a8a41b7.jpg)

**Comment by grunta** [comment]
I am having the same bug.
Also everytime I close flipboard and then reopen it. It asks me to log in again. It also crashes when loading stories.
Dropbox will not open native files such as xls, docx and pdf
Uninstall xcon and everything works normally.

**Comment by budakcivic** [comment]
Thanks for Beta 2. Already install n reboot many times still facing same problem. Some picture or link failed to loading on twitter. Any solution? Thanks an advance.

**Comment by BillyCotton** [comment]
I'm also having this issue. Thanks for your hard work so far.

**Comment by RiotNrrrd** [comment]
Can confirm this issue as well.  Reverted back to 40~beta1 and it's still there  :(

**Comment by RiotNrrrd** [comment]
I tried to do a bit of debugging.

Twitter talks to a host in the Twitter domain at IP address 199.96.57.7.  Maybe that's the hosting site for the images/videos, I dunno.

When xCon is not installed, I see a normal packet traffic flow between my iPad and that particular host IP.

If xCon 40 Beta is installed however, I do see traffic between them but I also see a lot of TCP RST (Reset) packets that are sent from the iPad to that host, which is very strange.  It seems to be enough such that it interferes with downloading of packets (presumably images/video thumbs) in the app.

For example:

`14:36:11.863457 IP 199.96.57.7.https > iPadAir.51391: . 39036:40496(1460) ack 628 win 33`
`14:36:11.863464 IP 199.96.57.7.https > iPadAir.51391: . 40496:41956(1460) ack 628 win 33`
`14:36:11.863536 IP 199.96.57.7.https > iPadAir.51391: . 41956:43416(1460) ack 628 win 33
14:36:11.863540 IP 199.96.57.7.https > iPadAir.51391: . 43416:44876(1460) ack 628 win 33
14:36:11.863557 IP iPadAir.51391 > 199.96.57.7.https: R 1544645785:1544645785(0) win 0
14:36:11.863558 IP iPadAir.51391 > 199.96.57.7.https: R 1544645785:1544645785(0) win 0
14:36:11.863572 IP iPadAir.51391 > 199.96.57.7.https: R 1544645785:1544645785(0) win 0
14:36:11.863601 IP iPadAir.51391 > 199.96.57.7.https: R 1544645785:1544645785(0) win 0

14:36:11.863690 IP 199.96.57.7.https > iPadAir.51391: P 44876:46336(1460) ack 628 win 33
14:36:11.863696 IP 199.96.57.7.https > iPadAir.51391: P 46336:47796(1460) ack 628 win 33
14:36:11.863732 IP iPadAir.51391 > 199.96.57.7.https: R 1544645785:1544645785(0) win 0
14:36:11.863774 IP iPadAir.51391 > 199.96.57.7.https: R 1544645785:1544645785(0) win 0

14:36:11.863810 IP 199.96.57.7.https > iPadAir.51391: P 47796:49256(1460) ack 628 win 33
14:36:11.863838 IP iPadAir.51391 > 199.96.57.7.https: R 1544645785:1544645785(0) win 0

14:36:11.864749 IP 199.96.57.7.https > iPadAir.51391: . 49256:50716(1460) ack 628 win 33
14:36:11.864758 IP 199.96.57.7.https > iPadAir.51391: . 50716:52176(1460) ack 628 win 33
14:36:11.864843 IP iPadAir.51391 > 199.96.57.7.https: R 1544645785:1544645785(0) win 0
14:36:11.864843 IP iPadAir.51391 > 199.96.57.7.https: R 1544645785:1544645785(0) win 0`

Every packet in this packet series was rejected with a RST.

**Comment by budakcivic** [comment]
Still same problem with beta4

**Comment by Lunat1k** [comment]
Beta5 should hopefully fix it now. I've had a lot of issues with then open api not working properly.

**Comment by BillyCotton** [comment]
Beta5 seems to fix the issue, but Jailbreak now seems to get detected by
the Lloyds Banking App - it seems to allow some detection to creep through
that wasn't on Beta2?

On Tuesday, March 24, 2015, Lunat1k <notifications@github.com> wrote:

> Beta5 should hopefully fix it now. I've had a lot of issues with then open
> api not working properly.
>
> —
> Reply to this email directly or view it on GitHub
> <https://github.com/n00neimp0rtant/xCon-Issues/issues/456#issuecomment-85610546>
> .
>


-- 
Sent from Gmail Mobile

**Comment by Lunat1k** [comment]
Looks like it's only available in the UK so I won't be able to get a copy of it unless someone sends me a "cracked" copy. you can use clutch to do it. But please open a new issue. 

https://github.com/KJCracks/Clutch/releases
